input_id,output_text
1,"The capital of France is Paris, located in the north-central part of the country along the Seine River."
2,"Quantum computing uses quantum bits (qubits) that can exist in multiple states simultaneously, allowing for exponentially faster calculations than classical computers."
3,"Cherry blossoms bloom, Gentle breeze carries sweet scent, Spring awakens life."
4,"To make chocolate chip cookies: cream butter and sugar, add eggs and vanilla, mix in flour and baking soda, fold in chocolate chips, bake at 375°F for 9-11 minutes."
5,"Renewable energy reduces greenhouse gas emissions, decreases dependence on fossil fuels, creates jobs, and provides sustainable long-term energy solutions."
6,"The water cycle involves evaporation from oceans and lakes, condensation into clouds, precipitation as rain or snow, and collection back into water bodies."
7,"Machine learning is a subset of AI where computers learn patterns from data without being explicitly programmed, improving performance through experience."
8,"Photosynthesis converts sunlight, carbon dioxide, and water into glucose and oxygen using chlorophyll in plant cells, providing energy for plant growth."
9,"Einstein's theory of relativity describes how space and time are interconnected and how gravity affects the fabric of spacetime, with time slowing near massive objects."
10,"Climate change is primarily caused by increased greenhouse gas emissions from human activities like burning fossil fuels, deforestation, and industrial processes."
11,"Vaccines work by introducing weakened or inactive pathogens to stimulate the immune system to produce antibodies, creating immunity without causing disease."
12,"AI is the broader concept of machines performing tasks intelligently, while ML is a specific approach to achieve AI through learning from data."
13,"The human digestive system breaks down food through mechanical and chemical processes, absorbing nutrients in the small intestine and eliminating waste."
14,"Solar panels convert sunlight into electricity using photovoltaic cells that generate electrical current when photons knock electrons loose from atoms."
15,"Blockchain is a distributed ledger technology that records transactions across multiple computers in a way that makes them tamper-resistant and transparent."
16,"DNA contains genetic instructions in four nucleotide bases (A, T, G, C) that code for proteins, with genes inherited from parents determining traits."
17,"The internet works through interconnected networks using protocols like TCP/IP to route data packets between computers worldwide."
18,"The moon phases occur due to its orbital position relative to Earth and the sun, creating different illuminated portions visible from Earth."
19,"Car engines convert fuel into motion through controlled explosions in cylinders, with pistons converting combustion pressure into rotational motion."
20,"Cryptocurrency is digital money secured by cryptography and decentralized through blockchain technology, operating without central authority."
21,"Birds fly using lift generated by their wing shape, thrust from wing beats, and lightweight hollow bones for efficient aerial movement."
22,"The greenhouse effect occurs when atmospheric gases trap heat from the sun, keeping Earth warm enough to support life."
23,"Artificial neural networks mimic biological neurons, processing information through interconnected nodes with weighted connections that learn patterns."
24,"GPS works using satellite signals to triangulate position, with receivers calculating distance to multiple satellites to determine precise location."
25,"An atom consists of a nucleus containing protons and neutrons, surrounded by electrons in energy shells or orbitals."
26,"Earthquakes occur when tectonic plates suddenly shift along fault lines, releasing stored energy as seismic waves through the Earth's crust."
27,"Antibiotics kill or inhibit bacterial growth by disrupting essential cellular processes like cell wall synthesis or protein production."
28,"Cloud computing delivers computing services over the internet, allowing on-demand access to servers, storage, and applications without local infrastructure."
29,"The nitrogen cycle converts atmospheric nitrogen through fixation, nitrification, and denitrification processes, making it available for biological use."
30,"3D printing builds objects layer by layer from digital designs using materials like plastics, metals, or ceramics through additive manufacturing."
31,"The atmosphere has five layers: troposphere (weather), stratosphere (ozone), mesosphere (meteors burn), thermosphere (aurora), and exosphere (space transition)."
32,"Gene therapy treats diseases by introducing genetic material into patient cells to correct defective genes or provide new cellular functions."
33,"Electric cars use battery-powered motors instead of combustion engines, converting electrical energy into mechanical motion with high efficiency."
34,"Infinity is a mathematical concept representing limitless quantity or extent, used to describe endlessly increasing values or unbounded sets."
35,"Ocean tides result from gravitational forces between Earth, moon, and sun, with the moon's proximity creating stronger tidal effects."
36,"Fiber optic communication transmits data as light pulses through glass fibers, enabling high-speed, long-distance information transfer."
37,"Evolution is the process by which species change over time through natural selection, genetic mutation, and environmental adaptation."
38,"Quantum entanglement is a phenomenon where particles become correlated so that measuring one instantly affects the other, regardless of distance."
39,"Wind turbines convert kinetic energy from moving air into electrical energy using rotating blades that drive generators."
40,"The brain consists of neurons organized into regions controlling different functions like memory, movement, and sensory processing."
41,"Dark matter is invisible matter that doesn't interact with light but exerts gravitational effects, comprising about 27% of the universe."
42,"Nuclear fission splits heavy atomic nuclei into lighter elements, releasing enormous energy used in power plants and weapons."
43,"Water treatment removes contaminants through filtration, sedimentation, disinfection, and chemical processes to produce safe drinking water."
44,"CRISPR is a gene editing tool that allows precise modification of DNA sequences, enabling treatment of genetic diseases and crop improvement."
45,"Submarines navigate underwater using sonar, GPS when surfaced, inertial navigation systems, and detailed charts of ocean depths."
46,"The carbon cycle moves carbon through atmosphere, oceans, land, and living organisms via processes like photosynthesis and respiration."
47,"Nanotechnology manipulates matter at the molecular scale to create materials and devices with novel properties and applications."
48,"MRI uses powerful magnetic fields and radio waves to create detailed images of internal body structures without ionizing radiation."
49,"Batteries store energy through chemical reactions between electrodes and electrolytes, converting chemical energy to electrical energy when needed."
50,"The Big Bang theory explains the universe's origin from an extremely hot, dense point that expanded and cooled over 13.8 billion years."
1,"Paris is the capital city of France and serves as its political, economic, and cultural center."
2,"Quantum computing harnesses quantum mechanical phenomena to process information in ways impossible for classical computers."
3,"Petals dance free, Nature's symphony begins, Hope blooms everywhere."
4,"Mix 1 cup butter, 3/4 cup brown sugar, 1/2 cup white sugar, 2 eggs, 2 1/4 cups flour, 1 tsp baking soda, 1 tsp salt, 2 cups chocolate chips. Bake 375°F for 10 minutes."
5,"Benefits include reduced carbon emissions, energy independence, job creation, and sustainable economic growth."
6,"Water evaporates, forms clouds, precipitates as rain, and flows back to oceans in a continuous cycle."
7,"Machine learning enables computers to improve performance on tasks through experience without explicit programming."
8,"Plants use sunlight to convert CO2 and water into glucose, releasing oxygen as a byproduct."
9,"Relativity shows that space and time are relative, mass affects spacetime curvature, and nothing travels faster than light."
10,"Human activities like fossil fuel combustion increase atmospheric CO2, trapping more heat and warming the planet."
11,"Vaccines train the immune system to recognize and fight specific diseases by exposing it to harmless versions of pathogens."
12,"Artificial Intelligence encompasses all intelligent machine behaviors, while Machine Learning specifically refers to learning from data."
13,"Food travels through mouth, esophagus, stomach, small intestine, and large intestine, with nutrients absorbed along the way."
14,"Photovoltaic cells in solar panels create electric current when sunlight excites electrons, generating clean electricity."
15,"Blockchain creates tamper-proof transaction records by linking cryptographically secured blocks across distributed networks."
16,"Genetic information stored in DNA determines inherited characteristics through sequences of nucleotide bases."
17,"Internet protocols route data packets through interconnected networks, enabling global communication and information sharing."
18,"Moon phases result from changing angles of sunlight reflection as the moon orbits Earth."
19,"Internal combustion engines burn fuel in cylinders, with expanding gases pushing pistons to create rotational motion."
20,"Digital currencies use cryptographic security and operate on decentralized networks without traditional banking intermediaries."
21,"Wing shape creates lift while flapping provides thrust, with hollow bones reducing weight for efficient flight."
22,"Atmospheric gases absorb and re-emit Earth's thermal radiation, maintaining temperatures suitable for life."
23,"Neural networks process information through interconnected artificial neurons that learn by adjusting connection weights."
24,"Satellite-based positioning calculates location by measuring signal travel times from multiple GPS satellites."
25,"Atoms contain a dense nucleus of protons and neutrons surrounded by orbiting electrons in distinct energy levels."
26,"Tectonic plate movements along fault lines suddenly release accumulated stress as earthquake vibrations."
27,"Antibiotics target specific bacterial structures or processes, killing bacteria or preventing their reproduction."
28,"Distributed computing resources accessed via internet, providing scalable services without local hardware requirements."
29,"Biological and chemical processes convert atmospheric nitrogen into forms usable by living organisms."
30,"Layer-by-layer construction from digital models using various materials and manufacturing techniques."
31,"Earth's atmosphere consists of distinct layers with different temperature, pressure, and composition characteristics."
32,"Therapeutic technique introducing functional genes to treat or prevent genetic disorders and diseases."
33,"Battery-powered electric motors provide efficient, quiet, zero-emission vehicle propulsion."
34,"Mathematical representation of unlimited or unbounded quantity, essential in calculus and set theory."
35,"Gravitational interactions between Earth, moon, and sun create regular rise and fall of sea levels."
36,"Light-based data transmission through optical fibers enables high-bandwidth, long-distance communication."
37,"Species change through genetic variation, natural selection, and environmental pressures over generations."
38,"Quantum phenomenon where particles share correlated properties instantaneously regardless of separation distance."
39,"Aerodynamic blades capture wind energy and rotate generators to produce electrical power."
40,"Complex neural networks process sensory input, control body functions, and enable consciousness and thought."
41,"Undetectable matter inferred from gravitational effects, forming the majority of universal mass."
42,"Heavy nuclei split into lighter elements, releasing binding energy used for power generation."
43,"Multi-stage purification removes physical, chemical, and biological contaminants from raw water sources."
44,"Precise DNA editing technology enabling targeted genetic modifications for therapeutic and research applications."
45,"Acoustic sonar, gyroscopic navigation, and electronic charts guide underwater vessel movement."
46,"Global circulation of carbon through Earth's atmosphere, hydrosphere, biosphere, and geosphere."
47,"Engineering at molecular scale creating materials with unique properties and applications."
48,"Magnetic resonance imaging provides detailed soft tissue visualization using magnetic fields and radio frequencies."
49,"Electrochemical energy storage devices converting chemical potential into electrical current on demand."
50,"Cosmological model describing universe expansion from initial singularity approximately 14 billion years ago."